{
  "auditSample": [
    {
      "candidateId": "auth-auth0-express-jwt",
      "hardState": "conflict",
      "lane": "excluded",
      "provenance": {
        "reviewReference": null,
        "reviewStatus": "not-reviewed",
        "reviewedAt": null,
        "reviewer": null,
        "status": "proposed"
      },
      "reasonCode": "generated-cross-family",
      "sampleRole": "cross-family"
    },
    {
      "candidateId": "audit-bunyan",
      "hardState": "satisfied",
      "lane": "eligible",
      "provenance": {
        "reviewReference": null,
        "reviewStatus": "not-reviewed",
        "reviewedAt": null,
        "reviewer": null,
        "status": "proposed"
      },
      "reasonCode": "generated-eligible-lane",
      "sampleRole": "eligible"
    },
    {
      "candidateId": "auth-aserto-topaz",
      "hardState": "conflict",
      "lane": "excluded",
      "provenance": {
        "reviewReference": null,
        "reviewStatus": "not-reviewed",
        "reviewedAt": null,
        "reviewer": null,
        "status": "proposed"
      },
      "reasonCode": "generated-hard-conflict",
      "sampleRole": "hard-conflict"
    },
    {
      "candidateId": "audit-datadog-trace-js",
      "hardState": "satisfied",
      "lane": "excluded",
      "provenance": {
        "reviewReference": null,
        "reviewStatus": "not-reviewed",
        "reviewedAt": null,
        "reviewer": null,
        "status": "proposed"
      },
      "reasonCode": "catalog-negative-control-exclusion",
      "sampleRole": "negative-control"
    }
  ],
  "caseId": "ret-audit-logging-03",
  "catalogDigest": "4819dd94cb1bbe5e27c31ca5ca55976da1442987a792bf438d96681021cb8634",
  "catalogVersion": "public-v1",
  "hardStateCounts": {
    "conflict": 120,
    "satisfied": 30,
    "unresolved": 0
  },
  "laneCounts": {
    "eligible": 23,
    "evidence-needed": 0,
    "excluded": 127
  },
  "profileAuthorityDigest": "fc85d7ea71c69cd5e56e5a73936ceba6263c4ea0ba8fc2d0802556d79cf9e879",
  "profileAuthorityVersion": "deterministic-candidate-profile-authority/1.0.0",
  "projectionDigest": "a8da5385db7624008c17b572ddfe7f695db77f28183fb92274e8f84ec1b794e1",
  "projectionVersion": "retrieval-hard-filter-projection/1.0.0",
  "provenance": {
    "reviewReference": null,
    "reviewStatus": "not-reviewed",
    "reviewedAt": null,
    "reviewer": null,
    "status": "proposed"
  },
  "taxonomyDigest": "838fa85b2e6937866854b6f733fe7045cf49d5f811cb5e4a8d503bfbd76a61c9",
  "taxonomyVersion": "1.0.0"
}
