{
  "auditSample": [
    {
      "candidateId": "audit-cabin",
      "hardState": "conflict",
      "lane": "excluded",
      "provenance": {
        "reviewReference": null,
        "reviewStatus": "not-reviewed",
        "reviewedAt": null,
        "reviewer": null,
        "status": "proposed"
      },
      "reasonCode": "generated-cross-family",
      "sampleRole": "cross-family"
    },
    {
      "candidateId": "webhook-adnanh",
      "hardState": "satisfied",
      "lane": "eligible",
      "provenance": {
        "reviewReference": null,
        "reviewStatus": "not-reviewed",
        "reviewedAt": null,
        "reviewer": null,
        "status": "proposed"
      },
      "reasonCode": "generated-eligible-lane",
      "sampleRole": "eligible"
    },
    {
      "candidateId": "audit-bunyan",
      "hardState": "conflict",
      "lane": "excluded",
      "provenance": {
        "reviewReference": null,
        "reviewStatus": "not-reviewed",
        "reviewedAt": null,
        "reviewer": null,
        "status": "proposed"
      },
      "reasonCode": "generated-hard-conflict",
      "sampleRole": "hard-conflict"
    },
    {
      "candidateId": "audit-datadog-trace-js",
      "hardState": "conflict",
      "lane": "excluded",
      "provenance": {
        "reviewReference": null,
        "reviewStatus": "not-reviewed",
        "reviewedAt": null,
        "reviewer": null,
        "status": "proposed"
      },
      "reasonCode": "catalog-negative-control-exclusion",
      "sampleRole": "negative-control"
    }
  ],
  "caseId": "ret-webhooks-02",
  "catalogDigest": "4819dd94cb1bbe5e27c31ca5ca55976da1442987a792bf438d96681021cb8634",
  "catalogVersion": "public-v1",
  "hardStateCounts": {
    "conflict": 120,
    "satisfied": 30,
    "unresolved": 0
  },
  "laneCounts": {
    "eligible": 13,
    "evidence-needed": 0,
    "excluded": 137
  },
  "profileAuthorityDigest": "9845ff004c83879de423a566ba906f033a83f7338fca9fc38b6324feffd07bdd",
  "profileAuthorityVersion": "deterministic-candidate-profile-authority/1.0.0",
  "projectionDigest": "740e7520b8f08a73165db43c4c79a4b91865243c82f17545ce732085b98a6398",
  "projectionVersion": "retrieval-hard-filter-projection/1.0.0",
  "provenance": {
    "reviewReference": null,
    "reviewStatus": "not-reviewed",
    "reviewedAt": null,
    "reviewer": null,
    "status": "proposed"
  },
  "taxonomyDigest": "8b2806ec8862390d0368e1c06ed657983916530f1207be9072d9e4787a61d80e",
  "taxonomyVersion": "1.0.0"
}
