{
  "auditSample": [
    {
      "candidateId": "auth-auth0-express-jwt",
      "hardState": "conflict",
      "lane": "excluded",
      "provenance": {
        "reviewReference": null,
        "reviewStatus": "not-reviewed",
        "reviewedAt": null,
        "reviewer": null,
        "status": "proposed"
      },
      "reasonCode": "generated-cross-family",
      "sampleRole": "cross-family"
    },
    {
      "candidateId": "audit-bunyan",
      "hardState": "unresolved",
      "lane": "evidence-needed",
      "provenance": {
        "reviewReference": null,
        "reviewStatus": "not-reviewed",
        "reviewedAt": null,
        "reviewer": null,
        "status": "proposed"
      },
      "reasonCode": "generated-evidence-needed-lane",
      "sampleRole": "evidence-needed"
    },
    {
      "candidateId": "auth-aserto-topaz",
      "hardState": "conflict",
      "lane": "excluded",
      "provenance": {
        "reviewReference": null,
        "reviewStatus": "not-reviewed",
        "reviewedAt": null,
        "reviewer": null,
        "status": "proposed"
      },
      "reasonCode": "generated-hard-conflict",
      "sampleRole": "hard-conflict"
    },
    {
      "candidateId": "audit-datadog-trace-js",
      "hardState": "unresolved",
      "lane": "excluded",
      "provenance": {
        "reviewReference": null,
        "reviewStatus": "not-reviewed",
        "reviewedAt": null,
        "reviewer": null,
        "status": "proposed"
      },
      "reasonCode": "catalog-negative-control-exclusion",
      "sampleRole": "negative-control"
    }
  ],
  "caseId": "ret-audit-logging-05",
  "catalogDigest": "4819dd94cb1bbe5e27c31ca5ca55976da1442987a792bf438d96681021cb8634",
  "catalogVersion": "public-v1",
  "hardStateCounts": {
    "conflict": 120,
    "satisfied": 0,
    "unresolved": 30
  },
  "laneCounts": {
    "eligible": 0,
    "evidence-needed": 23,
    "excluded": 127
  },
  "profileAuthorityDigest": "9845ff004c83879de423a566ba906f033a83f7338fca9fc38b6324feffd07bdd",
  "profileAuthorityVersion": "deterministic-candidate-profile-authority/1.0.0",
  "projectionDigest": "4449512bf12ccf9ac80296714a909620b5552893c1fa1e6f46c4c366e9ca91eb",
  "projectionVersion": "retrieval-hard-filter-projection/1.0.0",
  "provenance": {
    "reviewReference": null,
    "reviewStatus": "not-reviewed",
    "reviewedAt": null,
    "reviewer": null,
    "status": "proposed"
  },
  "taxonomyDigest": "8b2806ec8862390d0368e1c06ed657983916530f1207be9072d9e4787a61d80e",
  "taxonomyVersion": "1.0.0"
}
